{
  "id": "2026-W29",
  "title": { "ja": "後継者ストック危機", "en": "Successor Stock Crisis" },
  "intro": {
    "ja": "人口が細るある地域で、名産を支えてきた職人たちが静かに引退していく。しばらくは何も起きない——ストックが尽きるその日までは。技術を次世代へ渡す投資で、崖の手前で踏みとどまれるか。",
    "en": "In a thinning region, the artisans who sustained a local specialty quietly retire. For a while, nothing happens — until the reserve runs out. Can investment in handing skills to the next generation stop the fall just before the cliff?"
  },
  "page": 2,
  "params": {
    "p2": { "s": 30, "d": 10, "e": 80, "al": "dp", "reboot": false },
    "hint": {
      "ja": "DX投資を素早く上げ、後継者ストック（スキルゲージ）の回復を見てください。平穏→崖落ちの瞬間を体験できます。",
      "en": "Raise DX investment quickly and watch the successor stock (skill gauge) recover. Feel the calm-to-cliff moment."
    }
  },
  "goal": {
    "ja": "後継者ストックを50以上に回復させ、ブランド産業の崩壊を止める",
    "en": "Recover successor stock above 50 and prevent the brand industry from collapsing"
  },
  "goalConds": [
    { "metric": "skillStock", "op": ">=", "value": 50 },
    { "metric": "brand", "op": ">=", "value": 40 }
  ],
  "difficulty": "normal",
  "discoveryId": "sce_successor_crisis"
}
